{"diagnostics":[{"code":"OFF-W5003","entityId":"https://openfinanceformat.org/examples/public-equity-traceable/resources/evidence","instanceLocation":"/resources/2/locations/1","parameters":{"locationIndex":1,"url":"https://example.org/evidence/synthetic-filing.txt"},"ruleId":"OFF.CORE.REMOTE_NOT_EVALUATED","severity":"warning"}],"evaluationContext":{"evaluatedAt":"2026-07-17T23:59:59Z","normalizerVersion":"0.1","offVersion":"0.1","requestedProfiles":["https://openfinanceformat.org/profiles/public-equity-research/0.1"]},"extensions":{"https://example.org/extensions/research-note/0.1":{"reviewState":"synthetic","supportsExecution":false}},"freshness":{"headlines":[{"entityId":"https://openfinanceformat.org/examples/public-equity-traceable/entities/output/forward-revenue","staleDependencyIds":[],"status":"current"}],"leaves":[{"entityId":"https://openfinanceformat.org/examples/public-equity-traceable/entities/assumption/growth","status":"current","threshold":"2026-07-18T00:00:00Z"},{"entityId":"https://openfinanceformat.org/examples/public-equity-traceable/entities/fact/revenue","status":"current","threshold":"2026-07-18T00:00:00Z"}]},"outcome":"validWithWarnings","packageIdentity":{"authors":[{"id":"https://example.org/analysts/synthetic","name":"Synthetic OFF Author"}],"canonicalUrl":"https://openfinanceformat.org/examples/public-equity-traceable/releases/1","declaredProfiles":["https://openfinanceformat.org/profiles/public-equity-research/0.1"],"entrypointResourceId":"https://openfinanceformat.org/examples/public-equity-traceable/resources/narrative","id":"https://openfinanceformat.org/examples/public-equity-traceable","license":{"id":"CC0-1.0","url":"https://creativecommons.org/publicdomain/zero/1.0/"},"publishedAt":"2026-07-17T12:00:00Z","releaseId":"https://openfinanceformat.org/examples/public-equity-traceable/releases/1","releaseVersion":"1","title":"Synthetic Public Equity Traceable package"},"profileEntities":{"https://openfinanceformat.org/profiles/public-equity-research/0.1":{"assumptions":[{"designation":"analystJudgment","effectiveDate":"2026-07-17","id":"https://openfinanceformat.org/examples/public-equity-traceable/entities/assumption/growth","label":"Forward revenue growth","reviewBy":"2026-07-18T00:00:00Z","scenarioIds":["https://openfinanceformat.org/examples/public-equity-traceable/entities/scenario/base"],"unitId":"https://openfinanceformat.org/examples/public-equity-traceable/entities/unit/ratio","value":{"type":"decimal","value":"0.1"}}],"attestations":[{"artifactResourceId":"https://openfinanceformat.org/examples/public-equity-traceable/resources/model","artifactSha256":"86fb920f7ee34bef0074fa1013e9f47adb383a3ed53507fb6572a5687df2a33e","attestedAt":"2026-07-17T12:00:00Z","authorId":"https://example.org/analysts/synthetic","id":"https://openfinanceformat.org/examples/public-equity-traceable/entities/attestation/forward-revenue","knownExclusions":[],"lineageBasis":"author-declared","lineageCompleteness":"attested-not-independently-verified","materialityPolicy":"Sourced revenue and the growth assumption are the complete material inputs to forward revenue.","outputIds":["https://openfinanceformat.org/examples/public-equity-traceable/entities/output/forward-revenue"],"scope":"The synthetic headline forward revenue."}],"outputs":[{"artifactResourceId":"https://openfinanceformat.org/examples/public-equity-traceable/resources/model","asOfDate":"2026-07-17","attestationId":"https://openfinanceformat.org/examples/public-equity-traceable/entities/attestation/forward-revenue","headline":true,"id":"https://openfinanceformat.org/examples/public-equity-traceable/entities/output/forward-revenue","label":"Forward revenue","methodology":"Multiplies sourced revenue by one plus the declared growth ratio: 100 × (1 + 0.1) = 110.","scenarioId":"https://openfinanceformat.org/examples/public-equity-traceable/entities/scenario/base","unitId":"https://openfinanceformat.org/examples/public-equity-traceable/entities/unit/usd","value":{"type":"decimal","value":"110"}}],"scenarios":[{"id":"https://openfinanceformat.org/examples/public-equity-traceable/entities/scenario/base","label":"Base case","role":"base"}],"securities":[{"exchange":"XNYS","id":"https://openfinanceformat.org/examples/public-equity-traceable/entities/security","issuerName":"Synthetic Issuer","reportingCurrencyUnitId":"https://openfinanceformat.org/examples/public-equity-traceable/entities/unit/usd","securityType":"common-stock","ticker":"SYN"}],"sourceFacts":[{"effectiveDate":"2026-06-30","id":"https://openfinanceformat.org/examples/public-equity-traceable/entities/fact/revenue","label":"Reported revenue","sourceId":"https://openfinanceformat.org/examples/public-equity-traceable/entities/source/filing","staleAt":"2026-07-18T00:00:00Z","unitId":"https://openfinanceformat.org/examples/public-equity-traceable/entities/unit/usd","value":{"type":"decimal","value":"100"}}],"sources":[{"evidenceResourceId":"https://openfinanceformat.org/examples/public-equity-traceable/resources/evidence","id":"https://openfinanceformat.org/examples/public-equity-traceable/entities/source/filing","publisher":"Synthetic Issuer","title":"Synthetic issuer filing"}],"units":[{"id":"https://openfinanceformat.org/examples/public-equity-traceable/entities/unit/ratio","kind":"ratio","label":"Ratio","symbol":"x"},{"currency":"USD","id":"https://openfinanceformat.org/examples/public-equity-traceable/entities/unit/usd","kind":"currency","label":"US dollars","symbol":"$"}]}},"profileResults":{"core":{"status":"passed"},"declared":[{"claim":"Traceable — author-declared lineage","lineageCompleteness":"attested-not-independently-verified","requested":true,"status":"passed","structuralConformance":"passed","uri":"https://openfinanceformat.org/profiles/public-equity-research/0.1"}]},"relationshipInventory":[{"fromResourceId":"https://openfinanceformat.org/examples/public-equity-traceable/resources/evidence","relation":"supports","toResourceId":"https://openfinanceformat.org/examples/public-equity-traceable/resources/model"},{"fromResourceId":"https://openfinanceformat.org/examples/public-equity-traceable/resources/narrative","relation":"describes","toResourceId":"https://openfinanceformat.org/examples/public-equity-traceable/resources/model"}],"resolvedLineage":[{"fromId":"https://openfinanceformat.org/examples/public-equity-traceable/entities/output/forward-revenue","material":true,"toId":"https://openfinanceformat.org/examples/public-equity-traceable/entities/assumption/growth"},{"fromId":"https://openfinanceformat.org/examples/public-equity-traceable/entities/output/forward-revenue","material":true,"toId":"https://openfinanceformat.org/examples/public-equity-traceable/entities/fact/revenue"}],"resourceInventory":[{"byteSize":75,"id":"https://openfinanceformat.org/examples/public-equity-traceable/resources/evidence","locations":[{"availability":"available","integrity":"verified","kind":"local","path":"evidence.txt"},{"availability":"notEvaluated","integrity":"notEvaluated","kind":"remote","url":"https://example.org/evidence/synthetic-filing.txt"}],"mediaType":"text/plain","roles":["source-evidence"],"sha256":"df41053bdc1888756d6b6a25efde95a9e3410cbbb2eb6635efdb158da876dd9b"},{"byteSize":60,"id":"https://openfinanceformat.org/examples/public-equity-traceable/resources/model","locations":[{"availability":"available","integrity":"verified","kind":"local","path":"model.csv"}],"mediaType":"text/csv","roles":["model-artifact"],"sha256":"86fb920f7ee34bef0074fa1013e9f47adb383a3ed53507fb6572a5687df2a33e"},{"byteSize":188,"id":"https://openfinanceformat.org/examples/public-equity-traceable/resources/narrative","locations":[{"availability":"available","integrity":"verified","kind":"local","path":"OFF.md"}],"mediaType":"text/markdown","roles":["entrypoint","narrative"],"sha256":"47d36969f6ebded49dee0c34b0b9976e2c83762ef0791a752989e8cb9f8be3f9"}]}
