{"diagnostics":[],"evaluationContext":{"evaluatedAt":"2026-07-17T12:00:00Z","normalizerVersion":"0.1","offVersion":"0.1","requestedProfiles":[]},"extensions":{},"outcome":"valid","packageIdentity":{"authors":[{"id":"https://example.org/analysts/synthetic","name":"Synthetic OFF Author"}],"canonicalUrl":"https://openfinanceformat.org/examples/core-minimal/releases/1","declaredProfiles":[],"entrypointResourceId":"https://openfinanceformat.org/examples/core-minimal/resources/narrative","id":"https://openfinanceformat.org/examples/core-minimal","license":{"id":"CC0-1.0","url":"https://creativecommons.org/publicdomain/zero/1.0/"},"publishedAt":"2026-07-17T12:00:00Z","releaseId":"https://openfinanceformat.org/examples/core-minimal/releases/1","releaseVersion":"1","title":"Minimal Core reference package"},"profileResults":{"core":{"status":"passed"},"declared":[]},"relationshipInventory":[],"resourceInventory":[{"byteSize":88,"id":"https://openfinanceformat.org/examples/core-minimal/resources/narrative","locations":[{"availability":"available","integrity":"verified","kind":"local","path":"OFF.md"}],"mediaType":"text/markdown","roles":["entrypoint","narrative"],"sha256":"363c92ab8903666ff06452f804ede1c9c7a5bc54e34d2a5442babbd51448a7d4"}]}
