{"diagnostics":[{"code":"OFF-W5003","entityId":"https://docs.google.com/spreadsheets/d/off-workbook-binding-example","instanceLocation":"/resources/0/locations/0","parameters":{"locationIndex":0,"url":"https://docs.google.com/spreadsheets/d/off-workbook-binding-example"},"ruleId":"OFF.CORE.REMOTE_NOT_EVALUATED","severity":"warning"}],"evaluationContext":{"evaluatedAt":"2026-07-25T12:00:00Z","normalizerVersion":"0.1","offVersion":"0.1","requestedProfiles":["https://openfinanceformat.org/profiles/workbook-binding/0.1"]},"extensions":{},"outcome":"validWithWarnings","packageIdentity":{"authors":[{"id":"https://openfinanceformat.org/authors/reference","name":"OFF Reference Project"}],"canonicalUrl":"https://openfinanceformat.org/examples/workbook-binding-google-snapshot/releases/1","declaredProfiles":["https://openfinanceformat.org/profiles/workbook-binding/0.1"],"entrypointResourceId":"https://openfinanceformat.org/examples/workbook-binding-google-snapshot/resources/entrypoint","id":"https://openfinanceformat.org/examples/workbook-binding-google-snapshot","license":{"id":"Apache-2.0"},"publishedAt":"2026-07-25T12:00:00Z","releaseId":"https://openfinanceformat.org/examples/workbook-binding-google-snapshot/releases/1","releaseVersion":"1","title":"Workbook Binding Google snapshot"},"profileEntities":{"https://openfinanceformat.org/profiles/workbook-binding/0.1":{"bindings":[{"id":"https://openfinanceformat.org/examples/workbook-binding-google-snapshot/bindings/revenue","locator":{"range":"$B$12","sheet":"Model"},"role":"output","status":"author-declared-not-evaluated","subjectId":"https://openfinanceformat.org/examples/workbook-binding-google-snapshot/subjects/revenue","workbookId":"https://openfinanceformat.org/examples/workbook-binding-google-snapshot/workbooks/main"}],"subjects":[{"id":"https://openfinanceformat.org/examples/workbook-binding-google-snapshot/subjects/revenue","label":"Revenue"}],"unevaluated":{"cellValues":"notEvaluated","formulas":"notEvaluated","locatorExistence":"notEvaluated","recalculation":"notEvaluated","workbookContents":"notEvaluated"},"workbooks":[{"capturedAt":"2026-07-25T11:45:00Z","format":"google-sheets-xlsx-export","id":"https://openfinanceformat.org/examples/workbook-binding-google-snapshot/workbooks/main","liveSourceResourceId":"https://docs.google.com/spreadsheets/d/off-workbook-binding-example","liveSourceStatus":"notEvaluated","snapshotResourceId":"https://openfinanceformat.org/examples/workbook-binding-google-snapshot/resources/workbook"}]}},"profileResults":{"core":{"status":"passed"},"declared":[{"claim":"Bound — author-declared workbook locators","requested":true,"status":"passed","uri":"https://openfinanceformat.org/profiles/workbook-binding/0.1"}]},"relationshipInventory":[],"resourceInventory":[{"id":"https://docs.google.com/spreadsheets/d/off-workbook-binding-example","locations":[{"availability":"notEvaluated","integrity":"notEvaluated","kind":"remote","url":"https://docs.google.com/spreadsheets/d/off-workbook-binding-example"}],"mediaType":"application/vnd.openxmlformats-officedocument.spreadsheetml.sheet","roles":["live-source"]},{"byteSize":243,"id":"https://openfinanceformat.org/examples/workbook-binding-google-snapshot/resources/entrypoint","locations":[{"availability":"available","integrity":"verified","kind":"local","path":"OFF.md"}],"mediaType":"text/markdown","roles":["entrypoint"],"sha256":"38aec17311c7a9e8d408ef22382b067a7eab5af61073e28a9f918f173916d478"},{"byteSize":25094,"id":"https://openfinanceformat.org/examples/workbook-binding-google-snapshot/resources/workbook","locations":[{"availability":"available","integrity":"verified","kind":"local","path":"workbook.xlsx"}],"mediaType":"application/vnd.openxmlformats-officedocument.spreadsheetml.sheet","roles":["workbook-snapshot"],"sha256":"4c87be84803f83156e1c61872de8edf0253100333c9badacb09de3c975e47748"}]}
